{
  "id": "mc_greenery_split_v1",
  "name": "Greenery -> crops / trees / shrubs (India)",
  "node": "greenery",
  "parent_class": "greenery",
  "topology": "per_node_split",
  "produces": [
    { "class": "crops",  "std_mapping": { "worldcover": 40, "usda": "Cropland" } },
    { "class": "trees",  "std_mapping": { "worldcover": 10, "usda": "Forest land" } },
    { "class": "shrubs", "std_mapping": { "worldcover": 20, "usda": "Shrub" } }
  ],
  "training": {
    "datasets": ["ds_farmforest_crops_v1", "ds_farmforest_trees_v1", "ds_worldcover_shrubs_v1"],
    "embedding": { "source": "alphaearth", "dim": 64 },
    "algo": "StandardScaler->LinearSVC",
    "class_weight": "balanced",
    "balancing": { "method": "class_weight_balanced", "residual_cap": 8000 }
  },
  "extent": {
    "spatial": { "type": "region", "value": "India" },
    "temporal": { "year": 2024 }
  },
  "metrics": {
    "accuracy": 0.963,
    "macro_f1": 0.884,
    "eval": "polygon-holdout",
    "n_test": 3014,
    "per_class": {
      "crops":  { "precision": 0.987, "recall": 0.943, "f1": 0.965, "support": 1500 },
      "trees":  { "precision": 0.997, "recall": 0.986, "f1": 0.991, "support": 1400 },
      "shrubs": { "precision": 0.548, "recall": 0.947, "f1": 0.695, "support": 114 }
    }
  },
  "artifact": { "path": "data/refine/greenery.joblib", "format": "sklearn-joblib" },
  "deployment": { "ee_asset": null, "tile_url": null, "expressible_as_bandmath": true },
  "lineage": { "base_model": "mc_base_pooled_v1", "derived_from": null },
  "about": {
    "description": "Per-node split that refines greenery pixels into crops, trees, or shrubs.",
    "intended_use": "Layered on the India base map wherever it predicts greenery.",
    "limitations": "shrubs are WorldCover-labelled (114 px) -> low precision (0.548); expert vs WorldCover label quality differs.",
    "evidence": "FarmForest expert crop (110) + tree (145) polygons; shrubs from ESA WorldCover code 20."
  },
  "zoo": { "published": false, "valid_region_label": "India / AEZ-?", "contributor": "" },
  "version": 1,
  "created": "2026-06-13T00:00:00Z"
}
